{
  "$schema": "https://json-schema.org/draft/2020-12/schema",
  "title": "fs-objective-linearization-3",
  "type": "object",
  "required": [
    "schema",
    "state_fingerprint",
    "manifest_fingerprint",
    "partition",
    "shards",
    "resolved_context"
  ],
  "properties": {
    "schema": {
      "const": "fs-objective-linearization-3"
    },
    "state_fingerprint": {
      "type": "string",
      "pattern": "^sha256:[0-9a-f]{64}$"
    },
    "manifest_fingerprint": {
      "type": "string",
      "pattern": "^sha256:[0-9a-f]{64}$"
    },
    "partition": {
      "type": "object",
      "required": [
        "n_ranks",
        "compatibility"
      ],
      "properties": {
        "n_ranks": {
          "type": "integer",
          "minimum": 1
        },
        "compatibility": {
          "const": "same_mesh_partition"
        }
      },
      "additionalProperties": false
    },
    "shards": {
      "type": "array",
      "minItems": 1,
      "items": {
        "type": "object",
        "required": [
          "file",
          "sha256"
        ],
        "properties": {
          "file": {
            "type": "string",
            "minLength": 1,
            "description": "Rank-local JSON state shard. Its ordered terms select HDF5 cache locations using both cache.file and cache.group; several terms may share a cache file."
          },
          "sha256": {
            "type": "string",
            "pattern": "^sha256:[0-9a-f]{64}$"
          }
        },
        "additionalProperties": false
      }
    },
    "resolved_context": {
      "type": "string"
    }
  },
  "additionalProperties": false
}
